{
  "catalogVersion": "telemetry-one.track-catalog.v1",
  "generatedBy": "telemetry-one curated GT7 tracklist asset seed",
  "notes": "Curated GT7 layout metadata from the official Gran Turismo tracklist asset, cross-checked against gt7info course.csv. Corners are generated as ordinal Corner 1..N entries from NumCorners only; sectors and centerLine are intentionally empty because neither source provides reliable sector boundaries or sampled layout geometry.",
  "tracks": [
    {
      "id": "gt7_watkins_glen_international",
      "name": "Watkins Glen International",
      "country": "United States",
      "sources": [
        {
          "url": "https://www.gran-turismo.com/common/dist/gt7/tracklist/assets/tracks.gb-DLTcO0kl.js",
          "sourceType": "official_gran_turismo_tracklist_asset",
          "retrievedAt": "2026-07-12",
          "note": "official Gran Turismo generated tracklist asset; public first-party source for layout ID, name, length, and cornerCount"
        }
      ],
      "layouts": [
        {
          "id": "gt7_watkins_glen_long_course",
          "name": "Watkins Glen Long Course",
          "lengthMeters": 5423,
          "sources": [
            {
              "url": "https://www.gran-turismo.com/common/dist/gt7/tracklist/assets/tracks.gb-DLTcO0kl.js",
              "sourceType": "official_gran_turismo_tracklist_asset",
              "retrievedAt": "2026-07-12",
              "note": "official Gran Turismo generated tracklist asset; public first-party source for layout ID, name, length, and cornerCount"
            }
          ],
          "sectors": [],
          "corners": []
        }
      ]
    },
    {
      "id": "gt7_yas_marina_circuit",
      "name": "Yas Marina Circuit",
      "country": "United Arab Emirates",
      "sources": [
        {
          "url": "https://www.gran-turismo.com/common/dist/gt7/tracklist/assets/tracks.gb-DLTcO0kl.js",
          "sourceType": "official_gran_turismo_tracklist_asset",
          "retrievedAt": "2026-07-12",
          "note": "official Gran Turismo generated tracklist asset; public first-party source for layout ID, name, length, and cornerCount"
        }
      ],
      "layouts": [
        {
          "id": "gt7_yas_marina_full_course",
          "name": "Full Course",
          "lengthMeters": 5281,
          "sources": [
            {
              "url": "https://www.gran-turismo.com/common/dist/gt7/tracklist/assets/tracks.gb-DLTcO0kl.js",
              "sourceType": "official_gran_turismo_tracklist_asset",
              "retrievedAt": "2026-07-12",
              "note": "official Gran Turismo generated tracklist asset; public first-party source for layout ID, name, length, and cornerCount"
            }
          ],
          "sectors": [],
          "corners": []
        }
      ]
    },
    {
      "id": "gt7_circuit_gilles_villeneuve",
      "name": "Circuit Gilles-Villeneuve",
      "sources": [
        {
          "url": "https://www.gran-turismo.com/common/dist/gt7/tracklist/assets/tracks.gb-DLTcO0kl.js",
          "sourceType": "official_gran_turismo_tracklist_asset",
          "retrievedAt": "2026-07-12",
          "note": "official Gran Turismo generated tracklist asset; public first-party source for layout ID, name, length, and cornerCount"
        }
      ],
      "layouts": [
        {
          "id": "gt7_circuit_gilles_villeneuve_full_course",
          "name": "Full Course",
          "lengthMeters": 4361,
          "sources": [
            {
              "url": "https://www.gran-turismo.com/common/dist/gt7/tracklist/assets/tracks.gb-DLTcO0kl.js",
              "sourceType": "official_gran_turismo_tracklist_asset",
              "retrievedAt": "2026-07-12",
              "note": "official Gran Turismo generated tracklist asset; public first-party source for layout ID, name, length, and cornerCount"
            }
          ],
          "sectors": [],
          "corners": []
        }
      ]
    }
  ]
}
